{"submission_id":"submission-current","dossier_id":"case-dossier-1","submitting_run_id":"case-run-1","basis_revision":"0","basis_state_digest":"sha256:c8fdd08bc12368f98d3aaa736d1bc1057d07ea18aba6b549a6039021205c175d","published_revision":"1","content_digest":"sha256:0a3c5c4fe80a923f459dc142f6505c1114a0e6d03ae3dcfa16c6418b595dd5d3","observed_evidence_digest":"sha256:726f8d54c9e898b4c8392ce9e6127c572574da1f9ca0be951eb2c46d137b875e","checks_digest":"sha256:f7a1260db5bd8af1ebf2948b842a614ff27c22ed6198b0ae04c8268354ad5873","created_at":"2026-09-04T03:02:01Z","created_operation_id":"op-submission-current","submission_digest":"sha256:1a2a78e2de3b5236f03a644e1618c9f1870a3714b437032a671916330da48888"}
