{"submission_id":"submission-history","dossier_id":"case-dossier-1","submitting_run_id":"case-run-1","basis_revision":"8","basis_state_digest":"sha256:5555555555555555555555555555555555555555555555555555555555555555","published_revision":"9","content_digest":"sha256:1111111111111111111111111111111111111111111111111111111111111111","observed_evidence_digest":"sha256:2222222222222222222222222222222222222222222222222222222222222222","checks_digest":"sha256:3333333333333333333333333333333333333333333333333333333333333333","created_at":"2026-09-04T03:02:01Z","created_operation_id":"op-submission-history","submission_digest":"sha256:09cbfc39e199d75fc00c41049d7c48f54fd7f31d6d93bcf268e6795d77d3e870"}
